{
  "schema": "arcanea.machine_preflight_receipt.v2",
  "workload": "image-generation",
  "sourceWorkload": "overnight",
  "performancePosture": "hold",
  "posture": "hold",
  "maxParallelCalls": 1,
  "checkedAt": "2026-08-25T15:47:26.144Z",
  "expiresAt": "2026-08-25T15:54:34.525Z",
  "checkedBy": "peak-performance/pp + starlight-storage-intelligence",
  "evidence": "pp overnight plan d5f051cbed1302018b045a0f5836f58c8c0272de065a49d71e297e541527ccb8; storage plan 356819faf6f96eaf5bd0c68ca5981841f12f4a06ca9d9dd181150a98dcc7f356; overnight workload is held until the blocking conditions are resolved.",
  "blockingConditions": [
    "RAM reserve is short: 4994MB free, 10240MB required.",
    "CPU is 72%, above the 60% overnight ceiling.",
    "21 Codex task runtimes exceed the overnight budget of 6.",
    "Storage is 8.1% free; image generation requires at least 15%."
  ],
  "ppPlan": {
    "timestamp": "2026-08-25T15:47:26.144Z",
    "hostname": "Starlight",
    "workload": "overnight",
    "decision": "hold",
    "summary": "overnight workload is held until the blocking conditions are resolved.",
    "posture": "constrain",
    "swarmPosture": "pause-new-swarms",
    "current": {
      "ramFreeMB": 4994,
      "ramUsedPct": 84,
      "cpuLoadPct": 72,
      "cpuSystemLoadPct": 40,
      "codexTaskRuntimes": 21,
      "mcpMemoryMB": 2696,
      "localModels": 0,
      "devServers": 1,
      "crashLoopApp": "",
      "crashLoopCount": 0
    },
    "budget": {
      "workloadReserveMB": 6144,
      "safetyFloorMB": 4096,
      "requiredFreeMB": 10240,
      "projectedFreeMB": -1150,
      "cpuCeilingPct": 60,
      "maxTaskRuntimes": 6,
      "maxParallelism": 1,
      "timeoutMinutes": 480
    },
    "requirements": {
      "sdsRequired": false,
      "cloudPreferred": true,
      "receiptRequired": true,
      "stopAfterWork": true,
      "explicitModelReserveRecommended": false,
      "strictMcpRecommended": false
    },
    "hardBlocks": [
      "RAM reserve is short: 4994MB free, 10240MB required.",
      "CPU is 72%, above the 60% overnight ceiling.",
      "21 Codex task runtimes exceed the overnight budget of 6."
    ],
    "constraints": [
      "PP posture is constrain; run one bounded workload with no new parallel agents.",
      "1 dev-server processes are active; stop completed servers before this workload."
    ],
    "actions": [
      "Archive inactive agent tasks and stop completed SDS-owned servers, then rerun preflight.",
      "Wait for active CPU work to finish and identify sustained kernel/I/O pressure before retrying.",
      "Archive inactive Codex tasks through the UI so their complete MCP trees exit coherently.",
      "Prefer a Vercel preview or cloud runner when the verification must outlive this local loop.",
      "Apply a 480-minute workload timeout and stop child processes at completion."
    ]
  },
  "ppPlanHash": "d5f051cbed1302018b045a0f5836f58c8c0272de065a49d71e297e541527ccb8",
  "storageEvidence": {
    "schema": "arcanea.storage_preflight_evidence.v1",
    "policy": "starlight-machine-performance-contract-v1.1",
    "planId": "storage_20260825_173934_710fc687",
    "generatedAt": "2026-08-25T15:39:34.525Z",
    "mode": "quick",
    "volume": "C:\\",
    "freeGiB": 77.2,
    "freePercent": 8.1,
    "storageState": "critical",
    "hardFloorPercent": 8,
    "mediaAdmissionPercent": 15,
    "mediaGenerationAllowed": false,
    "rawPlanHash": "356819faf6f96eaf5bd0c68ca5981841f12f4a06ca9d9dd181150a98dcc7f356",
    "evidenceHash": "aba233f0e697ea3032b1dff9e7c1687146e5c9ac3552c6ec87a5505ff3f8fdf3"
  },
  "receiptHash": "44ae66c8cb4164dddb9cd5a10ac4d08e975595bc650a252327649c7ef3bade2a"
}
